<?xml version="1.0" encoding="UTF-8"?>
<!--
Copyright 2019 slavb.

Licensed under the Apache License, Version 2.0 (the "License");
you may not use this file except in compliance with the License.
You may obtain a copy of the License at

     http://www.apache.org/licenses/LICENSE-2.0

Unless required by applicable law or agreed to in writing, software
distributed under the License is distributed on an "AS IS" BASIS,
WITHOUT WARRANTIES OR CONDITIONS OF ANY KIND, either express or implied.
See the License for the specific language governing permissions and
limitations under the License.
-->


<dossierModel
    xmlns:xsi="http://www.w3.org/2001/XMLSchema-instance"
    xmlns="urn:ru:ilb:filedossier:model"
    xsi:schemaLocation="urn:ru:ilb:filedossier:model ../../../../../filedossier-api/src/main/resources/schemas/filedossier/model.xsd">
    <code>TEST</code>
    <name>Тестовое досье</name>
    <dossierModelFile>
        <code>file1</code>
        <name>Файл 1</name>
        <readonly>false</readonly>
        <required>true</required>
    </dossierModelFile>
    <dossierModelFile>
        <code>file2</code>
        <name>Файл 2</name>
        <readonlyExpression>a=false</readonlyExpression>
    </dossierModelFile>

</dossierModel>
